name,url,description,category,pricing,hasApi,tags,datasetId,author,downloads,popularityTier,sizeCategoryTier,recencyTier,languageTier,licenseTier,modalityTier,taskCategoryTier,downloadVolumeTier,creatorTier,likes,lastModified,createdAt,license,modality,sizeCategory,taskCategories,language,urlDomainTier,descriptionLengthTier,categorizationTier
PublicDatasets/voxbox-en,https://huggingface.co/datasets/publicdatasets/voxbox-en,"(audio modality) — 6,191 downloads",audio,open-source,false,"[""size_categories:10m<n<100m"",""modality:audio"",""modality:text""]",PublicDatasets/voxbox-en,PublicDatasets,6191,rest,large,recent,unknown,unknown,audio,unknown,emerging,community,1,2025-12-30T00:34:38.000Z,2025-12-29T01:43:51.000Z,,audio,10M<n<100M,[],[],registry-hosted,terse,specific
AmazonScience/document-haystack,https://huggingface.co/datasets/amazonscience/document-haystack,"Document Haystack Dataset This repository contains the dataset for the paper “Document Haystack: A Long Context Multimodal Image/Document Understanding Vision LLM Benchmark”. 📑 Abstract Paper The proliferation of multimodal Large Language Models has significantly advanced the ability to analyze and understand complex data inputs from different modalities. However, the processing of long docume...",benchmark-and-eval,open-source,false,"[""task_categories:question-answering"",""task_categories:visual-question-answering"",""task_categories:document-question-answering"",""language:en"",""modality:text"",""modality:image"",""modality:document"",""long-context"",""multimodal"",""llm"",""vlm"",""benchmark""]",AmazonScience/document-haystack,AmazonScience,34419,top25pct,unknown,older,monolingual,unknown,text,qa,niche,community,20,2025-08-04T22:04:44.000Z,2025-04-28T18:52:32.000Z,,text,,"[""question-answering"",""visual-question-answering"",""document-question-answering""]","[""en""]",registry-hosted,detailed,specific
bigcode/the-stack,https://huggingface.co/datasets/bigcode/the-stack,Dataset Card for The Stack Changelog Release Description v1.0 Initial release of the Stack. Included 30 programming languages and 18 permissive licenses. Note: Three included licenses (MPL/EPL/LGPL) are considered weak copyleft licenses. The resulting near-deduplicated dataset is 3TB in size. v1.1 The three copyleft licenses ((MPL/EPL/LGPL) were excluded and the list of permissive licenses exte...,code,open-source,false,"[""task_categories:text-generation"",""language:code"",""size_categories:100m<n<1b"",""modality:tabular"",""modality:text""]",bigcode/the-stack,bigcode,15218,rest,huge,ancient,monolingual,unknown,tabular,generative,niche,research-org,992,2023-04-13T12:15:50.000Z,2022-10-03T03:34:54.000Z,other,tabular,100M<n<1B,"[""text-generation""]","[""code""]",registry-hosted,detailed,specific
Jiaqi-hkust/Robust-R1,https://huggingface.co/datasets/jiaqi-hkust/robust-r1,"Robust-R1:Degradation-Aware Reasoning for Robust Visual Understanding ✅ Copyright Statement Our dataset is built upon a subset of A-OKVQA (Schwenket al. 2022), comprising 10K samples for training and 1K for validation. This statement serves to clarify that the copyright for original visual content is held by the provider. If you wish to use original content itself, you must obtain permission fr...",image,open-source,false,"[""task_categories:visual-question-answering"",""language:en"",""size_categories:10k<n<100k"",""modality:image""]",Jiaqi-hkust/Robust-R1,Jiaqi-hkust,11464,rest,medium,recent,monolingual,permissive,image,multimodal,niche,community,5,2025-12-22T11:21:40.000Z,2025-11-09T15:34:42.000Z,mit,image,10K<n<100K,"[""visual-question-answering""]","[""en""]",registry-hosted,detailed,specific
CYX1998/Meissa-SFT,https://huggingface.co/datasets/cyx1998/meissa-sft,"Meissa-SFT: Medical Agentic SFT Training Data This dataset contains the open-source portion of the SFT (Supervised Fine-Tuning) training data for Meissa, a lightweight 4B-parameter medical multi-modal LLM with full agentic capability. Dataset Summary Total samples: 25,018 Format: ShareGPT (compatible with LLaMA-Factory) Language: English Domain: Medical (radiology, pathology, clinical reasoning...",instruct-and-chat,open-source,false,"[""task_categories:question-answering"",""task_categories:visual-question-answering"",""language:en"",""size_categories:10k<n<100k"",""modality:image"",""medical"",""agent"",""tool-calling"",""multi-agent"",""clinical-simulation"",""sft""]",CYX1998/Meissa-SFT,CYX1998,14429,rest,medium,recent,monolingual,permissive,image,qa,niche,community,2,2026-03-12T07:16:48.000Z,2026-03-11T22:39:10.000Z,apache-2.0,image,10K<n<100K,"[""question-answering"",""visual-question-answering""]","[""en""]",registry-hosted,detailed,specific
lerobot/aloha_sim_insertion_scripted,https://huggingface.co/datasets/lerobot/aloha_sim_insertion_scripted,"This dataset was created using LeRobot. Dataset Structure meta/info.json: { ""codebase_version"": ""v2.0"", ""robot_type"": ""aloha"", ""total_episodes"": 50, ""total_frames"": 20000, ""total_tasks"": 1, ""total_videos"": 50, ""total_chunks"": 1, ""chunks_size"": 1000, ""fps"": 50, ""splits"": { ""train"": ""0:50"" }, ""data_path"": ""data/chunk-{episode_chunk:03d}/episode_{episode_index:06d}.parquet"", ""video_path"":… See the...",multimodal,open-source,false,"[""task_categories:robotics"",""size_categories:10k<n<100k"",""modality:tabular"",""modality:timeseries"",""modality:video"",""lerobot"",""aloha""]",lerobot/aloha_sim_insertion_scripted,lerobot,12613,rest,medium,recent,unknown,permissive,tabular,specialized,niche,benchmark-suite,5,2026-03-05T16:51:26.000Z,2024-03-23T13:27:29.000Z,mit,tabular,10K<n<100K,"[""robotics""]",[],registry-hosted,detailed,specific
ogutsevda/graph-bracs,https://huggingface.co/datasets/ogutsevda/graph-bracs,"Graph-BRACS: A Cell-Graph Dataset for Breast Cancer from BRACS Graph-BRACS is a graph-level classification dataset derived from the BRACS (BReAst Carcinoma Subtyping) histopathology dataset. Each region-of-interest (ROI) image is converted into a cell-graph where nodes represent detected cell nuclei and edges encode spatial proximity, enabling graph-based learning for fine-grained breast lesion...",other,open-source,false,"[""task_categories:graph-ml"",""size_categories:1k<n<10k"",""histopathology"",""graph-classification"",""breast-cancer"",""pytorch-geometric""]",ogutsevda/graph-bracs,ogutsevda,9274,rest,small,recent,unknown,proprietary,unknown,specialized,emerging,community,9,2026-03-03T08:56:15.000Z,2026-02-11T17:53:25.000Z,cc-by-nc-sa-4.0,,1K<n<10K,"[""graph-ml""]",[],registry-hosted,detailed,other
HuggingFaceTB/smoltalk2,https://huggingface.co/datasets/huggingfacetb/smoltalk2,"SmolTalk2 Dataset description This dataset contains three subsets (Mid, SFT, Preference) that correspond to the three phases of Post-Training for SmolLM3-3B. You can find more details in our blog post about how we used the data in each of the stages SmolLM3. The specific weight of each subset is available in the training recipe in SmolLM's repository. You can load a dataset using from datasets ...",preference-and-rlhf,open-source,false,"[""size_categories:1m<n<10m"",""modality:text""]",HuggingFaceTB/smoltalk2,HuggingFaceTB,6554,rest,large,older,unknown,unknown,text,unknown,emerging,frontier-lab,154,2025-10-31T13:49:55.000Z,2025-07-10T13:42:16.000Z,,text,1M<n<10M,[],[],registry-hosted,detailed,specific
frovolts/Lipi-Ghor-bn-882-SSTT,https://huggingface.co/datasets/frovolts/lipi-ghor-bn-882-sstt,"🗣️ Lipi-Ghor | লিপিঘর — Bengali Speech Dataset (bn-882-SSTT) Lipi-Ghor (লিপিঘর, meaning ""House of Scripts"") is a large-scale Bengali speech dataset designed for automatic speech recognition (ASR), speaker diarization, and spoken language research. It is one of the largest open Bengali speech corpora with aligned speaker, transcription, and timestamp annotations.Built by Team_Villagers as part ...",speech,open-source,false,"[""task_categories:automatic-speech-recognition"",""task_categories:audio-classification"",""language:bn"",""size_categories:1k<n<10k"",""bengali"",""bangla"",""speech"",""diarization"",""asr"",""low-resource"",""sstt"",""dl-sprint-4""]",frovolts/Lipi-Ghor-bn-882-SSTT,frovolts,4800,rest,small,fresh,monolingual,permissive,unknown,specialized,emerging,community,0,2026-04-11T08:48:41.000Z,2026-04-11T08:48:35.000Z,cc-by-4.0,,1K<n<10K,"[""automatic-speech-recognition"",""audio-classification""]","[""bn""]",registry-hosted,detailed,specific
apple/GSM-Symbolic,https://huggingface.co/datasets/apple/gsm-symbolic,"GSM-Symbolic This project accompanies the research paper, GSM-Symbolic: Understanding the Limitations of Mathematical Reasoning in Large Language Models. Getting Started In our first release, we provide data for GSM-Symbolic, GSM-Symbolic-P1, and GSM-Symbolic-P2 variants. For each variant, we have released both templates (available on Github), and a sample of generated data that can be used for...",tabular,open-source,false,"[""size_categories:10k<n<100k"",""modality:tabular"",""modality:text""]",apple/GSM-Symbolic,apple,5084,rest,medium,stale,unknown,proprietary,tabular,unknown,emerging,frontier-lab,24,2024-12-09T17:40:03.000Z,2024-12-08T20:38:23.000Z,cc-by-nc-nd-4.0,tabular,10K<n<100K,[],[],registry-hosted,detailed,specific
miracl/miracl-corpus,https://huggingface.co/datasets/miracl/miracl-corpus,"Dataset Card for MIRACL Corpus MIRACL 🌍🙌🌏 (Multilingual Information Retrieval Across a Continuum of Languages) is a multilingual retrieval dataset that focuses on search across 18 different languages, which collectively encompass over three billion native speakers around the world. This dataset contains the collection data of the 16 ""known languages"". The remaining 2 ""surprise languages"" wil...",text,open-source,false,"[""task_categories:text-retrieval"",""task_ids:document-retrieval"",""language:ar"",""language:bn"",""language:en"",""language:es"",""language:fa"",""language:fi"",""language:fr"",""language:hi"",""language:id"",""language:ja""]",miracl/miracl-corpus,miracl,5143,rest,large,ancient,massively-multilingual,permissive,text,discriminative,emerging,community,52,2023-01-05T17:28:26.000Z,2022-09-29T14:49:58.000Z,apache-2.0,text,10M<n<100M,"[""text-retrieval""]","[""ar"",""bn"",""en"",""es"",""fa"",""fi"",""fr"",""hi"",""id"",""ja"",""ko"",""ru"",""sw"",""te"",""th"",""zh""]",registry-hosted,detailed,specific
Helsinki-NLP/multiun,https://huggingface.co/datasets/helsinki-nlp/multiun,"Dataset Card for OPUS MultiUN Dataset Summary The MultiUN parallel corpus is extracted from the United Nations Website , and then cleaned and converted to XML at Language Technology Lab in DFKI GmbH (LT-DFKI), Germany. The documents were published by UN from 2000 to 2009. This is a collection of translated documents from the United Nations originally compiled by Andreas Eisele and Yu Chen (see ...",translation,open-source,false,"[""task_categories:translation"",""language:ar"",""language:de"",""language:en"",""language:es"",""language:fr"",""language:ru"",""language:zh"",""size_categories:100m<n<1b"",""modality:text""]",Helsinki-NLP/multiun,Helsinki-NLP,7142,rest,huge,ancient,multilingual,unknown,text,generative,emerging,community,12,2024-02-27T16:59:52.000Z,2022-03-02T23:29:22.000Z,unknown,text,100M<n<1B,"[""translation""]","[""ar"",""de"",""en"",""es"",""fr"",""ru"",""zh""]",registry-hosted,detailed,specific
BarryFutureman/dsolo,https://huggingface.co/datasets/barryfutureman/dsolo,"(video modality) — 5,016 downloads",video,open-source,false,"[""size_categories:1k<n<10k"",""modality:video""]",BarryFutureman/dsolo,BarryFutureman,5016,rest,small,fresh,unknown,unknown,video,unknown,emerging,community,0,2026-05-01T01:29:32.000Z,2026-05-01T01:02:42.000Z,,video,1K<n<10K,[],[],registry-hosted,terse,specific
junaiddbz/TTS_Audios,https://huggingface.co/datasets/junaiddbz/tts_audios,"(audio modality) — license: mit — 7,666 downloads",audio,open-source,false,"[""size_categories:n<1k"",""modality:audio""]",junaiddbz/TTS_Audios,junaiddbz,7666,rest,tiny,fresh,unknown,permissive,audio,unknown,emerging,community,0,2026-04-27T17:01:10.000Z,2026-03-04T17:04:57.000Z,mit,audio,n<1K,[],[],registry-hosted,terse,specific
evatan/GAIA-modified,https://huggingface.co/datasets/evatan/gaia-modified,"GAIA dataset GAIA is a benchmark which aims at evaluating next-generation LLMs (LLMs with augmented capabilities due to added tooling, efficient prompting, access to search, etc). We added gating to prevent bots from scraping the dataset. Please do not reshare the validation or test set in a crawlable format. Data and leaderboard GAIA is made of more than 450 non-trivial question with an unambi...",benchmark-and-eval,open-source,true,"[""language:en""]",evatan/GAIA-modified,evatan,7922,rest,unknown,older,monolingual,unknown,unknown,unknown,emerging,community,0,2025-06-23T08:10:57.000Z,2025-06-23T07:58:24.000Z,,,,[],"[""en""]",registry-hosted,detailed,specific
nkp37/MotionSight,https://huggingface.co/datasets/nkp37/motionsight,"This is the dataset proposed in our paper MotionSight: Boosting Fine-Grained Motion Understanding in Multimodal LLMs. We split the dataset into multiple small files, you can recover by cat: cat MotionSightDataset_part* > MotionSightDataset.zip unzip MotionSightDataset Project Page | Github",code,open-source,false,"[""task_categories:text-generation"",""language:en"",""size_categories:10k<n<100k"",""video-question-answering"",""video-understanding"",""motion-understanding"",""fine-grained-motion"",""multimodal"",""prompts""]",nkp37/MotionSight,nkp37,22624,top25pct,medium,older,monolingual,permissive,unknown,generative,niche,community,1,2025-09-18T12:36:57.000Z,2025-06-04T08:37:25.000Z,cc-by-4.0,,10K<n<100K,"[""text-generation""]","[""en""]",registry-hosted,detailed,specific
WenhaoWang/VideoUFO,https://huggingface.co/datasets/wenhaowang/videoufo,"News 🎉 Accepted by NeurIPS 2025 Datasets and Benchmarks Track. ✨ Ranked Top 1 in the Hugging Face Dataset Trending List for text-to-video generation on March 7, 2025. 💗 Financially supported by OpenAI through the Researcher Access Program. 🌟 Downloaded 10,000+ times on Hugging Face after one month of release. 🔥 Featured in Hugging Face Daily Papers on March 4, 2025. 👍 Drawn interest from l...",image,open-source,false,"[""task_categories:text-to-video"",""task_categories:text-to-image"",""task_categories:image-to-video"",""task_categories:image-to-image"",""language:en"",""size_categories:1m<n<10m"",""modality:image"",""modality:text"",""video-generation"",""text-to-video-dataset""]",WenhaoWang/VideoUFO,WenhaoWang,6205,rest,large,older,monolingual,permissive,image,generative,emerging,community,23,2025-09-19T08:35:17.000Z,2025-02-18T04:18:29.000Z,cc-by-4.0,image,1M<n<10M,"[""text-to-video"",""text-to-image"",""image-to-video"",""image-to-image""]","[""en""]",registry-hosted,detailed,specific
nvidia/OCR-Synthetic-Multilingual-v1,https://huggingface.co/datasets/nvidia/ocr-synthetic-multilingual-v1,"OCR-Synthetic-Multilingual-v1 Dataset Description Large-scale synthetically generated OCR training dataset for multilingual text detection and recognition. The data was produced using a heavily modified and extended version of SynthDoG (Synthetic Document Generator), originally introduced in the Donut project by Kim et al. This dataset was used to train Nemotron OCR v2, a state-of-the-art multi...",instruct-and-chat,open-source,false,"[""task_categories:object-detection"",""task_categories:image-to-text"",""language:en"",""language:ja"",""language:ko"",""language:ru"",""language:zh"",""size_categories:10m<n<100m"",""ocr"",""text-detection"",""text-recognition"",""synthetic-data""]",nvidia/OCR-Synthetic-Multilingual-v1,nvidia,7230,rest,large,fresh,multilingual,permissive,unknown,discriminative,emerging,frontier-lab,28,2026-04-20T23:01:02.000Z,2026-04-08T16:15:27.000Z,cc-by-4.0,,10M<n<100M,"[""object-detection"",""image-to-text""]","[""en"",""ja"",""ko"",""ru"",""zh""]",registry-hosted,detailed,specific
mllmTeam/MobileViews,https://huggingface.co/datasets/mllmteam/mobileviews,"🚀 MobileViews: A Large-Scale Mobile GUI Dataset MobileViews is a large-scale dataset designed to support research on mobile agents and mobile user interface (UI) analysis. The first release, MobileViews-600K, includes over 600,000 mobile UI screenshot-view hierarchy (VH) pairs collected from over 20,000 apps on the Google Play Store. This dataset is based on the DroidBot, which we have optimiz...",multimodal,open-source,false,"[""task_categories:question-answering"",""task_categories:image-to-text"",""task_ids:task-planning"",""task_ids:visual-question-answering"",""language:en"",""mobile-ui"",""user-interfaces"",""view-hierarchy"",""android-apps"",""screenshots""]",mllmTeam/MobileViews,mllmTeam,9111,rest,unknown,stale,monolingual,permissive,unknown,qa,emerging,community,39,2024-12-16T03:55:15.000Z,2024-09-25T04:24:30.000Z,mit,,,"[""question-answering"",""image-to-text""]","[""en""]",registry-hosted,detailed,specific
HorizonRobotics/EmbodiedGenData,https://huggingface.co/datasets/horizonrobotics/embodiedgendata,https://huggingface.co/spaces/HorizonRobotics/EmbodiedGen-Gallery-Explorer,other,open-source,false,"[""size_categories:n<1k"",""modality:3d"",""modality:image"",""modality:video""]",HorizonRobotics/EmbodiedGenData,HorizonRobotics,6744,rest,tiny,recent,unknown,permissive,structured,unknown,emerging,community,2,2026-01-26T13:48:48.000Z,2025-10-02T08:14:38.000Z,apache-2.0,3d,n<1K,[],[],registry-hosted,normal,other
