_dataset,name,url,description,category,pricing,hasApi,tags,openSource,urlDomainTier,descriptionLengthTier,categorizationTier
vscode-extensions,Code Time,https://marketplace.visualstudio.com/items?itemname=softwaredotcom.swdc-vscode,Code Time is an open source plugin that provides programming metrics right in Visual Studio Code.,ai-assistant,unknown,false,"[""ai"",""chat"",""codetime"",""flow"",""mode"",""productivity"",""time""]",,commercial,normal,specific
vscode-extensions,GitHub Copilot for Azure,https://marketplace.visualstudio.com/items?itemname=ms-azuretools.vscode-azure-github-copilot,"GitHub Copilot for Azure is the @azure extension. It's designed to help streamline the process of developing for Azure. You can ask @azure questions about Azure services or get help with tasks related to Azure and developing for Azure, all from within Visual Studio Code.",cloud-and-devops,unknown,false,"[""azure"",""ai"",""chat"",""agent"",""azure"",""chat"",""chat-participant"",""copilot"",""github-copilot"",""language-model-tools"",""tools""]",,commercial,detailed,specific
vscode-extensions,Database Client JDBC,https://marketplace.visualstudio.com/items?itemname=cweijan.dbclient-jdbc,JDBC Adapter For Database Client,database-and-sql,unknown,false,"[""other"",""oracle""]",,commercial,terse,specific
vscode-extensions,Lua Debugger,https://marketplace.visualstudio.com/items?itemname=devcat.lua-debug,"Visual Studio Code debugger extension for Lua 5.1, 5.2, 5.3",debuggers,unknown,false,"[""debuggers"",""debuggers""]",,commercial,normal,specific
vscode-extensions,Visual Studio Code API,https://code.visualstudio.com/api,section of Official Documentation,documentation,unknown,true,"[""documentation""]",,commercial,terse,specific
