_dataset,name,url,description,category,pricing,hasApi,tags,openSource,urlDomainTier,descriptionLengthTier,categorizationTier
ai-agents,LangGraph,https://github.com/langchain-ai/langgraph,LangGraph — autonomous API,autonomous,open-source,false,"[""general purpose""]",true,repo-hosted,absent,specific
ai-agents,LLM Stack,https://llmstack.ai/,LLM Stack — AI agent,browser,freemium,false,"[""build-your-own no-code web ui""]",false,commercial,terse,specific
ai-agents,Friday,https://github.com/amirrezasalimi/friday,Friday — AI agent,coding,open-source,false,"[""coding""]",false,repo-hosted,terse,specific
ai-agents,Fine Tuner,https://fine-tuner.ai/,Fine Tuner — AI agent,conversation,open-source,false,"[""open-source""]",true,commercial,terse,specific
ai-agents,Google Imagen 4,https://deepmind.google/,State-of-art photorealism. API via AI Studio.,creative,freemium,true,"[""image generation""]",,commercial,terse,specific
ai-models-pricing,Google: Gemini 3.1 Flash Lite Preview via Google [unknown],https://openrouter.ai/google/gemini-3.1-flash-lite-preview#provider=google-unknown,"Gemini 3.1 Flash Lite Preview is Google's high-efficiency model optimized for high-volume use cases. It outperforms Gemini 2.5 Flash Lite on overall quality and approaches Gemini 2.5 Flash performance across... — 1,048,576 context, $0.25/M input, $1.50/M output via Google.",audio,unknown,false,[],,commercial,detailed,specific
ai-models-pricing,DeepSeek: DeepSeek V3.2 via Parasail [fp8],https://openrouter.ai/deepseek/deepseek-v3.2#provider=parasail-fp8,"DeepSeek-V3.2 is a large language model designed to harmonize high computational efficiency with strong reasoning and agentic tool-use performance. It introduces DeepSeek Sparse Attention (DSA), a fine-grained sparse attention mechanism... — 163,840 context, $0.28/M input, $0.45/M output via Parasail.",chat,unknown,false,[],,commercial,detailed,specific
ai-models-pricing,AlfredPros: CodeLLaMa 7B Instruct Solidity via Featherless [unknown],https://openrouter.ai/alfredpros/codellama-7b-instruct-solidity#provider=featherless-unknown,"A finetuned 7 billion parameters Code LLaMA - Instruct model to generate Solidity smart contract using 4-bit QLoRA finetuning provided by PEFT library. — 4,096 context, $0.80/M input, $1.20/M output via Featherless.",code,unknown,false,[],,commercial,detailed,specific
ai-models-pricing,Prime Intellect: INTELLECT-3 via Nebius [fp8],https://openrouter.ai/prime-intellect/intellect-3#provider=nebius-fp8,"INTELLECT-3 is a 106B-parameter Mixture-of-Experts model (12B active) post-trained from GLM-4.5-Air-Base using supervised fine-tuning (SFT) followed by large-scale reinforcement learning (RL). It offers state-of-the-art performance for its size across math,... — 131,072 context, $0.20/M input, $1.10/M output via Nebius.",fine-tunable,unknown,false,[],,commercial,detailed,specific
ai-models-pricing,Google: Nano Banana 2 (Gemini 3.1 Flash Image Preview) via Google AI Studio [unknown],https://openrouter.ai/google/gemini-3.1-flash-image-preview#provider=google-ai-studio-unknown,"Gemini 3.1 Flash Image Preview, a.k.a. ""Nano Banana 2,"" is Google’s latest state of the art image generation and editing model, delivering Pro-level visual quality at Flash speed. It combines... — 65,536 context, $0.50/M input, $3.00/M output via Google AI Studio.",image-generation,unknown,false,[],,commercial,detailed,specific
ai-prompts,Critical Thinking (DeepThink),https://prompts.chat/prompts/critical-thinking-deepthink,Critical Thinking (DeepThink),analyst-and-researcher,unknown,false,"[""ai-prompts"",""text"",""general""]",,commercial,terse,specific
ai-prompts,MPPT Simulation仿真代码,https://prompts.chat/prompts/mppt-simulation,MPPT Simulation仿真代码,coding-assistant,unknown,false,"[""ai-prompts"",""text"",""general""]",,commercial,terse,specific
ai-prompts,OSINT Threat Intelligence Analysis Workflow,https://prompts.chat/prompts/osint-threat-intelligence-analysis-workflow,OSINT Threat Intelligence Analysis Workflow,creative,unknown,false,"[""ai-prompts"",""text"",""general""]",,commercial,terse,specific
ai-prompts,Integration and Planning Roadmap for Calculator Content,https://prompts.chat/prompts/integration-and-planning-roadmap-for-calculator-content,Integration and Planning Roadmap for Calculator Content,data-and-tools,unknown,false,"[""ai-prompts"",""text"",""general""]",,commercial,normal,specific
ai-prompts,Mine,https://prompts.chat/prompts/mine,Mine — image-generation API,image-generation,unknown,false,"[""ai-prompts"",""text"",""general""]",,commercial,absent,specific
ai-tools,Wispr Flow,https://wisprflow.ai/,Flow makes writing quick with seamless voice dictation for any application on your computer.,audio,freemium,false,"[""audio"",""speech-to-text""]",,commercial,normal,specific
ai-tools,OpenLIT,https://github.com/openlit/openlit,Open-source GenAI and LLM observability platform native to OpenTelemetry with traces and metrics.,code,open-source,true,"[""coding"",""developer tools""]",,repo-hosted,normal,specific
ai-tools,Practical Statistics for Data Scientists by Peter Bruce and Andrew Bruce,https://www.oreilly.com/library/view/practical-statistics-for/9781491952955,Practical Statistics for Data Scientists by Peter Bruce and Andrew Bruce,data,unknown,true,"[""books and academic journals""]",,commercial,normal,specific
ai-tools,align-anything,https://github.com/pku-alignment/align-anything,"Training all-modality models with feedback. Supports RLHF, DPO, and alignment fine-tuning for text, image, audio, and video models with seamless Slurm cluster integration. Apache 2.0 licensed.",image,open-source,false,"[""contents"",""7. training & fine-tuning ecosystem""]",,repo-hosted,normal,specific
ai-tools,Burr,https://github.com/apache/burr,"Apache incubating framework for building stateful AI applications (chatbots, agents, simulations). Monitor, trace, persist, and execute on your own infrastructure with built-in UI and pluggable memory. Apache 2.0 licensed.",multimodal,open-source,true,"[""contents"",""4. agentic ai & multi-agent systems""]",,repo-hosted,detailed,specific
cybersecurity-tools,passpie,https://github.com/marcwebbie/passpie,Multiplatform command-line password manager,authentication,open-source,false,"[""datastores""]",,repo-hosted,terse,specific
cybersecurity-tools,Grype,https://github.com/anchore/grype,[F] — SBOM-driven image vulnerability scanning.,cloud,open-source,false,"[""containers & kubernetes""]",,repo-hosted,terse,specific
cybersecurity-tools,Probable-Wordlists,https://github.com/berzerk0/probable-wordlists,[F] — Frequency-based lists.,cryptography,open-source,false,"[""credentials, cracking & wordlists""]",,repo-hosted,terse,specific
cybersecurity-tools,OWASP NodeGoat,https://github.com/owasp/nodegoat,OWASP NodeGoat — ctf API,ctf,open-source,false,"[""intentionally vulnerable systems"",""intentionally vulnerable systems as docker containers""]",,repo-hosted,absent,specific
cybersecurity-tools,Netwrix - MS SQL Server Hardening Best Practices,https://www.netwrix.com/sql_server_security_best_practices.html,Netwrix - MS SQL Server Hardening Best Practices,endpoint,unknown,false,"[""services"",""database servers""]",,commercial,terse,specific
design-resources,OpenSCAD,https://www.openscad.org/,a software for creating solid 3D CAD objects.,3d,unknown,false,"[""table of content"",""three d modeling software""]",,commercial,terse,specific
design-resources,Microsoft Inclusive Design,https://inclusive.microsoft.design/,"methodology, born out of digital environments, that enables and draws on the full range of human diversity",accessibility,free,false,"[""research & accessibility (ux, usability, a11y)""]",,commercial,normal,specific
design-resources,Unity,https://unity.com/,"build high-quality 3D and 2D games, deploy them across mobile, desktop and VR/AR.",augmented-reality,unknown,false,"[""table of content"",""augmented reality""]",,commercial,normal,specific
design-resources,Sympli,https://sympli.io,"automated specs and assets handoff from Sketch, Photoshop and Adobe XD. Integrated with Jira, Xcode and Android Studio.",collaboration,unknown,false,"[""table of content"",""design handoff tools""]",,commercial,normal,specific
design-resources,Color Shades Generator,https://mdigi.tools/color-shades,"We can quickly generate color shades of our favorite colors or any colors, to create templates or css components with multiple color shades and more useful tools available on same site",colors,free,false,"[""colors""]",,commercial,normal,specific
developer-tools,JetBrains AI,https://www.jetbrains.com/ai,JetBrains’s AI offering integrated into most of their IDEs.,ai-coding,paid,false,"[""ai coding""]",,commercial,normal,specific
developer-tools,Baremetrics,https://baremetrics.com/,Subscription analytics for Stripe.,analytics,freemium,false,"[""analytics""]",,commercial,terse,specific
developer-tools,numverify,https://numverify.com/,Global phone number validation and lookup JSON API. 100 API requests/month,authentication,freemium,true,"[""international mobile number verification api and sdk""]",,commercial,normal,specific
developer-tools,clickup.com,https://clickup.com/,"Project management. Free, premium version with cloud storage. Mobile applications and Git integrations are available.",automation,freemium,false,"[""issue tracking and project management""]",,commercial,normal,specific
developer-tools,Flutter Flow,https://flutterflow.io,Build your Flutter App UI without writing a single line of code. Also has a Firebase integration. The free plan includes full access to UI Builder and Free templates.,backend-as-a-service,free,false,"[""baas""]",,commercial,normal,specific
homebrew-packages,libks,https://github.com/signalwire/libks,Foundational support for signalwire C products,cli-tool,open-source,false,"[""core""]",,repo-hosted,terse,specific
homebrew-packages,fileql,https://github.com/amrdeveloper/fileql,Run SQL-like query on local files instead of database files using the GitQL SDK,database,open-source,true,"[""core""]",,repo-hosted,normal,specific
homebrew-packages,libdsk,https://www.seasip.info/unix/libdsk,Library for accessing discs and disc image files,dev-library,unknown,false,"[""core""]",,commercial,terse,specific
homebrew-packages,nfov,https://github.com/nrlquaker/nfov,ASCII / ANSI art viewer,gui-app,open-source,false,"[""cask""]",,repo-hosted,terse,specific
homebrew-packages,tealdeer,https://tealdeer-rs.github.io/tealdeer,Very fast implementation of tldr in Rust,language-runtime,unknown,false,"[""core""]",,commercial,terse,specific
huggingface-datasets,andy-gg/LUAR_RP_PC,https://huggingface.co/datasets/andy-gg/luar_rp_pc,"(audio modality) — 10,889 downloads",audio,unknown,false,"[""size_categories:n<1k"",""modality:audio"",""modality:image"",""modality:text""]",,registry-hosted,terse,specific
huggingface-datasets,wenshengdfgsf/RFUAV,https://huggingface.co/datasets/wenshengdfgsf/rfuav,"The RFUAV DATASET This repository contains the RFUAV dataset, presented in the paper ""RFUAV: A Benchmark Dataset for Unmanned Aerial Vehicle Detection and Identification"". RFUAV provides approximately 1.3 TB of raw frequency data collected from 37 distinct UAVs, offering a comprehensive benchmark for radio-frequency-based drone detection and identification. The dataset addresses limitations of ...",benchmark-and-eval,unknown,false,"[""task_categories:audio-classification"",""language:en"",""language:zh"",""modality:image"",""signal-processing"",""drone-detection"",""drone-identification"",""rf-signal""]",,registry-hosted,detailed,specific
huggingface-datasets,simmo/python-fim,https://huggingface.co/datasets/simmo/python-fim,Python Stack | Fill-in-the-Middle This is a conversion or adaptation of The Stack to a python FIM task. The example column is B64 encoded because people like to put special characters in their code that csv files dont like so I encoded the strings before saving them to disk.,code,unknown,false,"[""task_categories:fill-mask"",""language:en"",""size_categories:10m<n<100m"",""modality:text"",""code""]",,registry-hosted,detailed,specific
huggingface-datasets,HuggingFaceM4/Docmatix,https://huggingface.co/datasets/huggingfacem4/docmatix,"Dataset Card for Docmatix Dataset description Docmatix is part of the Idefics3 release (stay tuned). It is a massive dataset for Document Visual Question Answering that was used for the fine-tuning of the vision-language model Idefics3. Load the dataset To load the dataset, install the library datasets with pip install datasets. Then, from datasets import load_dataset ds = load_dataset(""Hugging...",image,unknown,false,"[""task_categories:visual-question-answering"",""language:en"",""size_categories:1m<n<10m"",""modality:image"",""modality:text"",""docvqa""]",,registry-hosted,detailed,specific
huggingface-datasets,lambda/hermes-agent-reasoning-traces,https://huggingface.co/datasets/lambda/hermes-agent-reasoning-traces,"Hermes Agent Reasoning Traces Multi-turn tool-calling trajectories for training AI agents using the Hermes Agent harness. Each sample is a real agent conversation with step-by-step reasoning (<think> blocks) and actual tool execution results. This dataset has two configs, one per source model: Config Model Samples kimi Moonshot AI Kimi-K2.5 7,646 glm-5.1 ZhipuAI GLM-5.1-FP8 7,055 Loading from d...",instruct-and-chat,unknown,false,"[""task_categories:text-generation"",""language:en"",""size_categories:10k<n<100k"",""modality:text"",""tool-calling"",""function-calling"",""agent"",""hermes"",""reasoning"",""sharegpt"",""sft"",""traces""]",,registry-hosted,detailed,specific
huggingface-models,microsoft/harrier-oss-v1-27b,https://huggingface.co/microsoft/harrier-oss-v1-27b,"feature extraction (sentence-transformers) — license: mit — 41,016 downloads",embedding,open-source,false,"[""sentence-transformers"",""safetensors"",""gemma3_text"",""feature-extraction"",""mteb"",""transformers"",""multilingual"",""af"",""am"",""ar"",""as"",""az""]",,registry-hosted,normal,specific
huggingface-models,facebook/dinov2-base-imagenet1k-1-layer,https://huggingface.co/facebook/dinov2-base-imagenet1k-1-layer,"image classification (transformers) — license: apache-2.0 — 36,279 downloads",image-classification,open-source,false,"[""transformers"",""pytorch"",""dinov2"",""image-classification"",""dino"",""vision"",""endpoints_compatible""]",,registry-hosted,normal,specific
huggingface-models,Comfy-Org/Qwen-Image-Layered_ComfyUI,https://huggingface.co/comfy-org/qwen-image-layered_comfyui,"(diffusion-single-file) — 38,799 downloads",image-generation,open-source,false,"[""diffusion-single-file"",""comfyui""]",,registry-hosted,terse,specific
huggingface-models,lmstudio-community/Qwen3-VL-8B-Instruct-MLX-5bit,https://huggingface.co/lmstudio-community/qwen3-vl-8b-instruct-mlx-5bit,"image text to text (mlx) — license: apache-2.0 — 101,371 downloads",multimodal,open-source,false,"[""mlx"",""safetensors"",""qwen3_vl"",""image-text-to-text"",""conversational"",""5-bit""]",,registry-hosted,normal,specific
huggingface-models,PaddlePaddle/PP-DocLayoutV3_safetensors,https://huggingface.co/paddlepaddle/pp-doclayoutv3_safetensors,"object detection (transformers) — license: apache-2.0 — 310,825 downloads",object-detection,open-source,false,"[""transformers"",""safetensors"",""pp_doclayout_v3"",""object-detection"",""paddleocr"",""paddlepaddle"",""image-segmentation"",""ocr"",""layout"",""layout_detection"",""en"",""zh""]",,registry-hosted,normal,specific
llmops-and-eval,A2UI,https://github.com/google/a2ui,A2UI is a framework for building agent-to-UI interactions.,agent-framework,open-source,true,"[""agent interfaces""]",,repo-hosted,normal,specific
llmops-and-eval,DVC,https://github.com/iterative/dvc,Data Version Control - Git for Data & Models - ML Experiments Management.,data-and-training,open-source,false,"[""data management""]",,repo-hosted,normal,specific
llmops-and-eval,Yunikorn,https://github.com/apache/yunikorn-core,"Light-weight, universal resource scheduler for container orchestrator systems.",deployment-and-infra,open-source,false,"[""scheduling""]",,repo-hosted,normal,specific
llmops-and-eval,FEDOT,https://github.com/nccr-itmo/fedot,AutoML framework for the design of composite pipelines.,fine-tuning,open-source,false,"[""automl""]",,repo-hosted,normal,specific
llmops-and-eval,DeepTeam,https://github.com/confident-ai/deepteam,"DeepTeam is a simple-to-use, open-source LLM red teaming framework, for penetration testing and safe guarding large-language model systems.",guardrails-and-safety,open-source,true,"[""agent security""]",,repo-hosted,normal,specific
mcp-servers,MCP Servers Search,https://github.com/atonomus/mcp-servers-search,An MCP server that provides tools for querying and discovering available MCP servers from this list.,aggregators,open-source,false,"[""for clients"",""open-source"",""aggregators""]",true,repo-hosted,normal,specific
mcp-servers,entanglr/zettelkasten-mcp,https://github.com/entanglr/zettelkasten-mcp,"A Model Context Protocol (MCP) server that implements the Zettelkasten knowledge management methodology, allowing you to create, link, and search atomic notes through Claude and other MCP-compatible clients.",ai-services,open-source,false,"[""knowledge & memory"",""open-source"",""ai-services""]",true,repo-hosted,detailed,specific
mcp-servers,MalluBeast69/gemini-img-gen-MCP,https://github.com/mallubeast69/gemini-img-gen-mcp,Generate images using Google's Gemini model via a dedicated MCP server.,art-literature,open-source,false,"[""multimedia processing"",""art-literature""]",,repo-hosted,normal,specific
mcp-servers,shipstatic/mcp,https://github.com/shipstatic/mcp,"Deploy and manage static sites from AI agents. A simpler alternative to Vercel and Netlify for static website hosting — upload files, get a URL, and connect custom domains.",cloud-platforms,open-source,false,"[""cloud platforms"",""open-source"",""cloud-platforms""]",true,repo-hosted,normal,specific
mcp-servers,Bucket,https://github.com/bucketco/bucket-javascript-sdk/tree/main/packages/cli#model-context-protocol,"Flag features, manage company data, and control feature access using Bucket",cloud-storage,open-source,false,"[""official servers"",""open-source"",""cloud-storage""]",true,repo-hosted,normal,specific
no-code-lowcode,Gravity-AI,https://www.gravity-ai.com/,The fastest & most secure way to solve business problems with A.I.,ai-ml,freemium,false,"[""ai""]",,commercial,normal,specific
no-code-lowcode,VisualSitemaps,https://visualsitemaps.com,Autogenerate Visual Sitemaps & Screenshots in Seconds,analytics,freemium,false,"[""analytics""]",,commercial,normal,specific
no-code-lowcode,Suriya,https://suriya.ai,"AI-powered app builder for Thai small businesses. Describe your idea, get a working custom app in 5 minutes. No code required. ฿349/month.",app-builder,freemium,false,"[""business apps""]",,commercial,normal,specific
no-code-lowcode,AutomationAnywhere,https://www.automationanywhere.com/,"A provider of robotic process automation (RPA) software that allows businesses to automate tasks using a combination of rules-based decision-making, machine learning, and artificial intelligence. Its platform includes a user-friendly interface for creating and deploying automation, and it can be used to automate tasks across various departments and industries.",automation,paid,false,"[""platforms"",""robotic process automation""]",,commercial,detailed,specific
no-code-lowcode,Intercom,https://www.intercom.com/,"Live chat, product tours, apps and more - build relationships with your customers.",chatbot,freemium,false,"[""chatbots""]",,commercial,normal,specific
npm-packages,@wonderwhy-er/desktop-commander,https://www.npmjs.com/package/@wonderwhy-er/desktop-commander,MCP server for terminal operations and file editing,ai-and-ml,unknown,false,"[""mcp"",""model-context-protocol"",""terminal"",""claude"",""ai"",""command-line"",""process-management"",""file-editing"",""code-editing"",""diff"",""patch"",""block-editing"",""file-system"",""text-manipulation"",""code-modification"",""surgical-edits"",""file-operations""]",,registry-hosted,normal,specific
npm-packages,passport-linkedin,https://www.npmjs.com/package/passport-linkedin,LinkedIn authentication strategy for Passport.,auth-and-security,unknown,false,"[""passport"",""linkedin"",""auth"",""authn"",""authentication"",""identity""]",,registry-hosted,terse,specific
npm-packages,@fastify/send,https://www.npmjs.com/package/@fastify/send,Better streaming static file server with Range and conditional-GET support,backend-framework,unknown,false,"[""static"",""file"",""server""]",,registry-hosted,normal,specific
npm-packages,optimize-css-assets-webpack-plugin,https://www.npmjs.com/package/optimize-css-assets-webpack-plugin,A Webpack plugin to optimize \ minimize CSS assets.,build-tool,unknown,false,"[""css"",""duplicate"",""extract-text-webpack-plugin"",""minimize"",""optimize"",""remove"",""webpack""]",,registry-hosted,normal,specific
npm-packages,@fig/complete-commander,https://www.npmjs.com/package/@fig/complete-commander,Export commander command as a Fig spec,cli-and-devops,unknown,false,"[""commander"",""fig"",""spec"",""generator"",""plugin"",""integration""]",,registry-hosted,terse,specific
open-source-alternatives,AnythingLLM,https://openalternative.co/anythingllm,The all-in-one AI application for everyone,ai-ml,open-source,false,"[""ai & machine learning"",""ai interaction & interfaces""]",,commercial,terse,specific
open-source-alternatives,CocoIndex,https://openalternative.co/cocoindex,Ultra-fast data transformation for AI with lineage,analytics,open-source,false,"[""data & analytics"",""data engineering & integration""]",,commercial,normal,specific
open-source-alternatives,Step CI,https://stepci.com/,API Testing and Monitoring,api-tools,open-source,true,"[""alternative-to-checkly"",""alternative-to-postman""]",,commercial,terse,specific
open-source-alternatives,Cerbos,https://openalternative.co/cerbos,"Secure, policy-based access control for modern applications",authentication,open-source,false,"[""security & privacy"",""identity & access management (iam)""]",,commercial,normal,specific
open-source-alternatives,RoboCorp,https://robocorp.com/,Set of tooling that allows to create automation packages,automation,open-source,false,"[""alternative-to-uipath""]",,commercial,normal,specific
platform-engineering,Autotools/Automake,https://www.gnu.org/software/automake,Autotools/Automake,ci-cd-pipeline,unknown,false,"[""continuous integration"",""build""]",,commercial,terse,specific
platform-engineering,Dokku- Open source PAAS alternative to Heroku,https://dokku.com/,Dokku- Open source PAAS alternative to Heroku,container-orchestration,open-source,false,"[""tooling— kubernetes, paas and cloud services""]",,commercial,terse,specific
platform-engineering,Redmine,https://www.redmine.org/,Redmine — developer-experience API,developer-experience,unknown,false,"[""development"",""project management & issue tracking software""]",,commercial,absent,specific
platform-engineering,Shipa,https://shipa.io/,"Shipa simplifies the way you deploy, secure, and manage applications across cloud native infrastructures by taking an application-centric approach.",developer-portal,unknown,true,"[""internal developer portal""]",,commercial,normal,specific
platform-engineering,ConfigCat - Privacy-first feature flag service,https://configcat.com/,ConfigCat - Privacy-first feature flag service,feature-flags,unknown,false,"[""tooling— feature flags, environments and change management""]",,commercial,terse,specific
public-apis,PlaceKitten,https://placekitten.com/,Placeholder Kitten pictures,animals,free,false,"[""animals"",""no-auth"",""cors-enabled""]",,commercial,terse,specific
public-apis,Waifu.pics,https://waifu.pics/docs,Image sharing platform for anime images,anime,free,false,"[""anime"",""no-auth""]",,commercial,terse,specific
public-apis,AbuseIPDB,https://docs.abuseipdb.com/,IP/domain/URL reputation,anti-malware,freemium,false,"[""anti-malware""]",,documentation,terse,specific
public-apis,Color Name API,https://elastiq.ch/,An API that provides names for colors based on their hex value,art-design,freemium,true,"[""developer-tools""]",,commercial,normal,specific
public-apis,GitHub Authentication,https://developer.github.com/guides/basics-of-authentication,Access to GitHub’s Authentication API.,authentication,freemium,true,"[""table of contents"",""login authentication""]",,commercial,terse,specific
self-hosted-software,Freshlytics,https://github.com/sheshbabu/freshlytics,"Privacy respecting, cookie free and low resource usage analytics platform.",analytics,free,false,"[""analytics""]",,repo-hosted,normal,specific
self-hosted-software,Open Archiver,https://openarchiver.com/,"Email archiving solution with full-text search and eDiscovery search features. (Demo, Source Code)",archiving,open-source,false,"[""software"",""archiving and digital preservation (dp)""]",,commercial,normal,specific
self-hosted-software,sysPass,http://www.syspass.org/,"Multiuser password management system. (Demo, Source Code)",authentication,open-source,false,"[""password managers""]",,commercial,normal,specific
self-hosted-software,Huginn,https://github.com/huginn/huginn,Build agents that monitor and act on your behalf.,automation,open-source,false,"[""software"",""automation""]",,repo-hosted,terse,specific
self-hosted-software,fx,https://github.com/rikhuijzer/fx,"Micro-blog tool offering built-in syntax highlighting, mobile publishing and more (alternative to Twitter, Bluesky).",blogging,open-source,false,"[""software"",""blogging platforms""]",,repo-hosted,normal,specific
vector-db-and-rag,GraphRAG,https://github.com/microsoft/graphrag,A structured approach using knowledge graphs for enhanced context integration and reasoning.,agentic-rag,open-source,false,"[""advanced approaches""]",,repo-hosted,normal,specific
