_dataset,name,url,description,category,pricing,hasApi,tags,openSource,urlDomainTier,descriptionLengthTier,categorizationTier
self-hosted-software,Access to Memory (AtoM),https://www.accesstomemory.org/,"Web-based, open source application for standards-based archival description and access in a multilingual, multi-repository environment. (Demo, Source Code)",archiving,open-source,false,"[""archiving and digital preservation (dp)""]",,commercial,normal,specific
self-hosted-software,sysPass,http://www.syspass.org/,"Multiuser password management system. (Demo, Source Code)",authentication,open-source,false,"[""password managers""]",,commercial,normal,specific
self-hosted-software,Beehive,https://github.com/muesli/beehive,"Flexible event and agent system, which allows you to create your own agents that perform automated tasks triggered by events and filters.",automation,open-source,false,"[""automation""]",,repo-hosted,normal,specific
self-hosted-software,Blogotext,http://lehollandaisvolant.net/blogotext,Free blog-engine written in PHP and using SQLite. This offers you both an unmatched simplicity during installation and great performances. (Source Code),blogging,free,false,"[""blogging platforms""]",,commercial,normal,specific
vector-db-and-rag,Self Reflective RAG,https://selfrag.github.io/,Models that dynamically adjust retrieval strategies based on model performance feedback.,agentic-rag,unknown,false,"[""advanced approaches""]",,commercial,normal,specific
vector-db-and-rag,Jaccard Similarity,https://en.wikipedia.org/wiki/Jaccard_index,Jaccard Similarity,rag-eval,unknown,false,"[""metrics & evaluation"",""similarity metrics for embeddings""]",,commercial,terse,specific
vector-db-and-rag,Cognita,https://github.com/truefoundry/cognita,Open-source RAG framework for building modular and production ready applications.,rag-framework,open-source,true,"[""frameworks that facilitate rag""]",,repo-hosted,normal,specific
vector-db-and-rag,OpenSearch,https://opensearch.org/,OpenSearch,search-engine,unknown,false,[],,commercial,terse,specific
vector-db-and-rag,QdrantCloud,https://cloud.qdrant.io/,QdrantCloud,vector-db-engine,unknown,false,[],,commercial,terse,specific
vscode-extensions,Vision for Copilot Preview,https://marketplace.visualstudio.com/items?itemName=ms-vscode.vscode-copilot-vision,"A chat extension providing vision capabilities in VS Code, with a focus on accessibility.",ai-assistant,unknown,false,"[""ai"",""chat"",""accessibility"",""ai"",""anthropic"",""chat-participant"",""claude"",""co-pilot"",""gemini"",""html"",""images"",""javascriptreact""]",,commercial,normal,specific
vscode-extensions,Typings auto installer,https://marketplace.visualstudio.com/items?itemName=jvitor83.typings-autoinstaller,Any time you save either package.json or bower.json the typings package will be installed/uninstalled automatically in the background.,cloud-and-devops,unknown,false,"[""other""]",,commercial,normal,specific
vscode-extensions,SQLite Viewer,https://marketplace.visualstudio.com/items?itemName=qwtel.sqlite-viewer,SQLite Viewer for VS Code,database-and-sql,unknown,false,"[""other"",""sql""]",,commercial,terse,specific
vscode-extensions,Statusbar Text,https://marketplace.visualstudio.com/items?itemName=Marceloxp.statusbartext,A custom Status Bar text to your vscode,debuggers,unknown,false,"[""debuggers"",""visualization""]",,commercial,terse,specific
vscode-extensions,codedox,https://marketplace.visualstudio.com/items?itemName=wiggin77.codedox,"JSDoc-style comments for Haxe. @param and @return tags, plus customizable file header license and copyright comments.",documentation,unknown,false,"[""other"",""comments"",""copyright"",""haxe"",""jsdoc"",""license""]",,commercial,normal,specific
