_dataset,name,url,description,category,pricing,hasApi,tags,openSource,urlDomainTier,descriptionLengthTier,categorizationTier
vector-db-and-rag,Jaccard Similarity,https://en.wikipedia.org/wiki/jaccard_index,Jaccard Similarity,rag-eval,unknown,false,"[""metrics & evaluation"",""similarity metrics for embeddings""]",,commercial,terse,specific
vector-db-and-rag,Document-Based Chunking,https://medium.com/@david.richards.tech/document-chunking-for-rag-ai-applications-04363d48fbf7,Document-Based Chunking,rag-framework,unknown,false,"[""techniques"",""chunking""]",,commercial,terse,specific
vector-db-and-rag,Meilisearch,https://www.meilisearch.com/solutions/vector-search,Meilisearch,search-engine,unknown,false,[],,commercial,terse,specific
vector-db-and-rag,Lantern,https://lantern.dev/,A privacy-aware personal search engine.,vector-db-engine,unknown,false,"[""databases"",""other database systems:""]",,commercial,terse,specific
vscode-extensions,DeepSeek for GitHub Copilot,https://marketplace.visualstudio.com/items?itemname=wassimdev.wassimdev-vscode-deepseek,Run DeepSeek models in your GitHub Copilot Chat,ai-assistant,unknown,false,"[""ai"",""chat"",""agent"",""ai"",""assistant"",""chat"",""chat-participant"",""copilot"",""deepseek"",""github-copilot"",""model"",""nlp""]",,commercial,terse,specific
vscode-extensions,Azure IoT Device Workbench,https://marketplace.visualstudio.com/items?itemname=vsciot-vscode.vscode-iot-workbench,This extension is now a part of Azure IoT Tools extension pack. We highly recommend installing Azure IoT Tools to get full capabilities for Azure IoT development.,cloud-and-devops,unknown,false,"[""azure"",""colorized-channel""]",,commercial,normal,specific
vscode-extensions,PostgreSQL Language Server,https://marketplace.visualstudio.com/items?itemname=uniquevision.vscode-plpgsql-lsp,VSCode PostgreSQL and PL/pgSQL Language Server.,database-and-sql,unknown,false,"[""other"",""language server"",""pl"",""pl/pgsql"",""plpgsql"",""postgres"",""postgresql""]",,commercial,terse,specific
vscode-extensions,Launch Configs,https://marketplace.visualstudio.com/items?itemname=arturodent.launch-config,Create shortcuts to launch specific debug configurations.,debuggers,unknown,false,"[""debuggers"",""debug"",""keybinding"",""launch""]",,commercial,normal,specific
vscode-extensions,Markdown Math,https://marketplace.visualstudio.com/items?itemname=koehlma.markdown-math,Adds math support to VS Code's built-in markdown preview.,documentation,unknown,false,"[""other""]",,commercial,normal,specific
